{
  "schema": "microtask/v1",
  "id": "MT-AGENTIC-IDE-001",
  "title": "Implement Phase 1: Core Foundation for Agentic IDE",
  "goal": "Extend OpenAgent with multi-agent support, Skills SDK, plugin/hook system foundation, and MCP gateway infrastructure.",
  "inputs": {
    "workspace": ".",
    "skills_registry": "packages/skills",
    "mcp_gateway": "packages/mcp-gateway",
    "plugin_system": "packages/plugins"
  },
  "allowed_actions": [
    "read",
    "write",
    "run_tests"
  ],
  "timeout_seconds": 600,
  "approval_policy": "require_approval_for_side_effects",
  "mcp_calls": [],
  "security": {
    "network": "deny",
    "filesystem": "workspace_only"
  }
}